"Status","Start Time","Stop Time","Duration in ms","Parent Suite","Suite","Sub Suite","Test Class","Test Method","Name","Description"
"passed","Sun Nov 03 11:10:21 UTC 2024","Sun Nov 03 11:10:29 UTC 2024","8941","","Test set for Sweet Shop Main Page.","","autotests.tests.e2e.MainPageOrderTests","checkPresenceSelectedItemInBasket","Testcase 1. Check that all the selected items are present in basket.","Testcase 1. Check that all the selected items are present in basket."
"passed","Sun Nov 03 11:10:06 UTC 2024","Sun Nov 03 11:10:15 UTC 2024","9117","","Test set for Sweet Shop Main Page.","","autotests.tests.e2e.MainPageOrderTests","checkBasketTotalPrice","Testcase 2. Test the basket Total sum matches the price of individual items based on quantity and currency.","Testcase 2. Test the basket Total sum matches the price of individual items based on quantity and currency."
"passed","Sun Nov 03 11:10:15 UTC 2024","Sun Nov 03 11:10:21 UTC 2024","5632","","Test set for Sweet Shop Main Page.","","autotests.tests.e2e.MainPageOrderTests","checkDeliveryTypeChanging","Testcase 3. Change the delivery type to 'Standard Shipping' and verify the total price.","Testcase 3. Change the delivery type to 'Standard Shipping' and verify the total price."
"passed","Sun Nov 03 11:09:53 UTC 2024","Sun Nov 03 11:10:06 UTC 2024","12241","","Test set for checkout page.","","autotests.tests.basket.CheckoutTests","checkFillingFormThenCheckout","Testcase 4. Verify checkout after filling form.","Testcase 4. Verify checkout after filling form."
"passed","Sun Nov 03 11:10:29 UTC 2024","Sun Nov 03 11:10:40 UTC 2024","10622","","Test set for Login page.","","autotests.tests.login.LoginTests","loginHappyPath","Testcase 5. Positive Login test.","Testcase 5. Positive Login test."
